{
  "schema_version": "hermes.cmo.request.v1",
  "request_id": "req_20260528_echo_001",
  "session_id": "session_h1_demo",
  "turn_id": "turn_echo_001",
  "created_at": "2026-05-28T10:10:00+07:00",
  "workspace": {
    "workspace_id": "world-app-holdstation-mini-app",
    "app_id": "holdstation-mini-app",
    "app_name": "Holdstation Mini App"
  },
  "user": {
    "user_id": "server_derived_user_id",
    "display_name": "Jay"
  },
  "intent": {
    "mode": "cmo.default",
    "user_message": "Turn this approved activation angle into 3 short X posts.",
    "explicit_command": null
  },
  "context_pack": {
    "current_priority": [],
    "selected_context": [
      {
        "type": "approved_brief",
        "title": "Activation content angle",
        "content": "Activation is the hidden growth lever: reduce first action friction, make the next useful step obvious, and avoid overclaiming metrics."
      }
    ],
    "recent_session_summary": "CMO already approved the strategic angle.",
    "indexed_context_supplement": [],
    "artifacts_in": []
  },
  "constraints": {
    "no_direct_vault_write": true,
    "no_direct_memory_mutation": true,
    "vault_agent_delegation_allowed": true,
    "vault_agent_requires_save_intent": true,
    "kanban_enabled": false,
    "demo_mode": true,
    "allowed_agents": ["echo", "surf", "vault_agent"],
    "allowed_surf_modes": [
      "surf.default",
      "surf.x",
      "surf.trend",
      "surf.pulse"
    ]
  },
  "ui": {
    "activity_stream_required": true,
    "heartbeat_required": true
  }
}
