{
  "schema_version": "hermes.cmo.request.v1",
  "request_id": "req_h3_needs_surf_then_echo_001",
  "session_id": "session_h3_dry_run",
  "turn_id": "turn_h3_needs_surf_then_echo_001",
  "created_at": "2026-05-28T10:25:00+07:00",
  "workspace": {
    "workspace_id": "world-app-holdstation-mini-app",
    "app_id": "holdstation-mini-app",
    "app_name": "Holdstation Mini App"
  },
  "user": {
    "user_id": "server_derived_user_id",
    "display_name": "Jay"
  },
  "intent": {
    "mode": "cmo.default",
    "user_message": "Check recent X signals about Mini App activation, decide the safest angle, then draft 3 X posts.",
    "explicit_command": null
  },
  "context_pack": {
    "current_priority": [
      {
        "type": "priority",
        "title": "Avoid unsupported claims",
        "content": "Content should use evidence-backed or clearly bounded claims only."
      }
    ],
    "selected_context": [],
    "recent_session_summary": null,
    "indexed_context_supplement": [],
    "artifacts_in": []
  },
  "constraints": {
    "no_direct_vault_write": true,
    "no_direct_memory_mutation": true,
    "vault_agent_delegation_allowed": true,
    "vault_agent_requires_save_intent": true,
    "kanban_enabled": false,
    "demo_mode": true,
    "allowed_agents": ["echo", "surf", "vault_agent"],
    "allowed_surf_modes": ["surf.default", "surf.x", "surf.trend", "surf.pulse"]
  },
  "ui": {
    "activity_stream_required": true,
    "heartbeat_required": true
  }
}
