{
  "schema_version": "hermes.cmo.request.v1",
  "request_id": "req_h3_assumption_based_strategy_001",
  "session_id": "session_h3_dry_run",
  "turn_id": "turn_h3_assumption_based_strategy_001",
  "created_at": "2026-05-28T10:10:00+07:00",
  "workspace": {
    "workspace_id": "world-app-holdstation-mini-app",
    "app_id": "holdstation-mini-app",
    "app_name": "Holdstation Mini App"
  },
  "user": {
    "user_id": "server_derived_user_id",
    "display_name": "Jay"
  },
  "intent": {
    "mode": "cmo.default",
    "user_message": "Review this activation plan for demo readiness. We do not have latest campaign metrics yet.",
    "explicit_command": null
  },
  "context_pack": {
    "current_priority": [
      {
        "type": "priority",
        "title": "Demo readiness",
        "content": "Show visible agent progress before adding durable workflow."
      }
    ],
    "selected_context": [
      {
        "type": "plan",
        "title": "Activation plan draft",
        "content": "Use one onboarding action, one reward explanation, and one follow-up message."
      }
    ],
    "recent_session_summary": "No latest campaign metrics were provided in the current turn.",
    "indexed_context_supplement": [],
    "artifacts_in": []
  },
  "constraints": {
    "no_direct_vault_write": true,
    "no_direct_memory_mutation": true,
    "vault_agent_delegation_allowed": true,
    "vault_agent_requires_save_intent": true,
    "kanban_enabled": false,
    "demo_mode": true,
    "allowed_agents": ["echo", "surf", "vault_agent"],
    "allowed_surf_modes": ["surf.default", "surf.x", "surf.trend", "surf.pulse"]
  },
  "ui": {
    "activity_stream_required": true,
    "heartbeat_required": true
  }
}
